{
  "protocol_version": "1.0",
  "session_id": "session_sample_001",
  "run_id": "run_sample_001",
  "block_id": "block_sample_questions",
  "block_version": 1,
  "idempotency_key": "answer_sample_001",
  "answers": [
    {
      "question_id": "budget",
      "value": {"minimum": "3000", "maximum": "5000", "currency": "CNY"},
      "client_updated_at": "2026-08-04T10:01:00+08:00"
    },
    {
      "question_id": "schedule",
      "value": {"duration": 10, "unit": "business_day", "timezone": "Asia/Shanghai"},
      "client_updated_at": "2026-08-04T10:01:00+08:00"
    }
  ]
}
